KPD_SIFRA	NAZIV	SEKTOR	RAZINA	FINALNA
32.20.14	Glazbeni i klavijaturni instrumenti kod kojih se zvuk proizvodi ili pojačava električnim sredstvima	C	5	DA
32.20.15	Ostali glazbeni instrumenti	C	5	DA
32.20.16	Metronomi, zvučne vilice i pisci za davanje visine tona; mehanizmi za glazbene kutije; žice za glazbene instrumente	C	5	DA
32.20.20	Dijelovi i pribor za glazbene instrumente	C	5	DA
32.20.99	Podugovarateljski poslovi kao dio proizvodnje glazbenih instrumenata	C	5	DA
32.30.11	Skije za snijeg i ostala skijaška oprema, osim obuće za snijeg; klizaljke i koturaljke; njihovi dijelovi	C	5	DA
32.30.12	Obuća za skijanje	C	5	DA
32.30.13	Skije za vodu, daske za surfanje, daske za jedrenje i ostala oprema za sportove na vodi	C	5	DA
32.30.14	Pribor i oprema za gimnastiku, fitness centre i atletiku	C	5	DA
32.30.15	Ostali pribor i oprema za sport i igre na otvorenom; bazeni za plivanje i dječji bazeni na napuhavanje	C	5	DA
32.30.16	Ribarski štapovi i ostali pribor za ribolov udicom; ostali pribor za lov i ribolov	C	5	DA
32.30.99	Podugovarateljski poslovi kao dio proizvodnje sportske opreme	C	5	DA
32.40.11	Lutke s ljudskim likom	C	5	DA
32.40.12	Igračke u obliku životinja ili drugih neljudskih bića	C	5	DA
32.40.13	Dijelovi i pribor za lutke s ljudskim likom	C	5	DA
32.40.20	Vlakovi igračke i njihov pribor; ostali smanjeni modeli, konstrukcije i igračke za sastavljanje	C	5	DA
32.40.31	Dječje igračke s kotačima za jahanje i vožnju; kolica za lutke	C	5	DA
32.40.32	Slagalice	C	5	DA
32.40.39	Ostale igračke, d. n.	C	5	DA
32.40.41	Igraće karte	C	5	DA
32.40.42	Predmeti za biljar, lunapark, stolne i društvene igre; ostale igre na automatima koji rade na kovanice ili žetone	C	5	DA
32.40.99	Podugovarateljski poslovi kao dio proizvodnje igara i igračaka	C	5	DA
32.50.11	Instrumenti i aparati za zubarsku uporabu	C	5	DA
32.50.12	Medicinski, kirurški i laboratorijski sterilizatori	C	5	DA
32.50.13	Štrcaljke, igle, kateteri, kanile i slično; oftalmološki i ostali instrumenti i aparati	C	5	DA
32.50.14	Ostali terapeutski instrumenti i aparati	C	5	DA
32.50.21	Umjetni zglobovi; ortopedska pomagala; umjetni zubi; zubne proteze; ostali umjetni dijelovi tijela	C	5	DA
32.50.22	Dijelovi i pribor proteza i ortopedskih pomagala	C	5	DA
32.50.30	Medicinski, kirurški, stomatološki i veterinarski namještaj; brijačke i slične stolice te njihovi dijelovi	C	5	DA
32.50.41	Kontaktne leće; leće za naočale od svih vrsta materijala	C	5	DA
32.50.42	Naočale i slični proizvodi, korektivni, zaštitni i drugi	C	5	DA
32.50.43	Okviri za naočale i slične proizvode	C	5	DA
32.50.44	Dijelovi okvira za naočale i slične proizvode	C	5	DA
32.50.50	Ostali proizvodi za medicinsku i kiruršku uporabu	C	5	DA
32.50.99	Podugovarateljski poslovi kao dio proizvodnje medicinskih i stomatoloških instrumenata i pribora	C	5	DA
32.91.11	Metle i četke za čišćenje u kućanstvu	C	5	DA
32.91.12	Četkice za zube, četke za kosu i druge toaletne četke za osobnu uporabu; slikarske i pisaće četkice i kistovi, četkice i kistovi za kozmetiku	C	5	DA
32.91.19	Ostale četke, d. n.	C	5	DA
32.91.99	Podugovarateljski poslovi kao dio proizvodnje metli i četki	C	5	DA
32.99.11	Zaštitna pokrivala za glavu i ostala zaštitna oprema	C	5	DA
32.99.12	Kemijske olovke; flomasteri i markeri s vrhom od pusta (filca) ili drugoga poroznog materijala; tehničke olovke	C	5	DA
32.99.13	Pera za kopiranje crteža; nalivpera, stilograf-pera i ostala pera	C	5	DA
32.99.14	Setovi za pisaći pribor, držala za olovke i kemijske olovke i slična držala; njihovi dijelovi	C	5	DA
32.99.15	Olovke, krejoni, mine za olovke, pastele, ugljen za crtanje, krede za pisanje ili crtanje i krojačke krede	C	5	DA
32.99.16	Pločice i ploče za pisanje i crtanje; datumari, žigovi, numeratori i slično; vrpce za pisaće strojeve i slične vrpce; jastučići za žigove na tintu	C	5	DA
32.99.21	Kišobrani i suncobrani; štapovi za hodanje, štapovi za sjedenje i slično	C	5	DA
32.99.22	Dijelovi, ukrasi i pribor za kišobrane, suncobrane, štapove za hodanje, štapove za sjedenje i slično	C	5	DA
32.99.23	Kopče, gumbi koje se kopča utiskivanjem i slično te njihovi dijelovi; gumbi; patentni zatvarači	C	5	DA
32.99.24	Presvučeni gumbi i ostali dijelovi gumba; nedovršeni gumbi; dijelovi patentnih zatvarača	C	5	DA
32.99.30	Proizvodi od ljudske i životinjske dlake; slični proizvodi od tekstilnih materijala	C	5	DA
32.99.41	Upaljači za cigarete i drugi upaljači; lule i držala cigara i cigareta te njihovi dijelovi	C	5	DA
32.99.42	Dijelovi upaljača; piroforne legure; proizvodi od zapaljivih materijala	C	5	DA
32.99.51	Praznički, karnevalski ili drugi proizvodi za razonodu	C	5	DA
32.99.52	Prskalice za mirise, njihova kućišta i glave	C	5	DA
32.99.53	Instrumenti, aparati i modeli za prezentacijsku uporabu	C	5	DA
32.99.54	Svijeće, svjećice i slično	C	5	DA
32.99.55	Umjetno cvijeće, lišće i voće te njihovi dijelovi	C	5	DA
32.99.59	Ostali raznovrsni proizvodi, d. n.	C	5	DA
32.99.60	Usluge prepariranja	C	5	DA
32.99.99	Podugovarateljski poslovi kao dio proizvodnje ostale proizvedene robe, d. n.	C	5	DA
33.11.01	Usluge popravka i održavanja građevinskih metalnih proizvoda	C	5	DA
33.11.02	Usluge popravka i održavanja cisterni, rezervoara i spremnika od metala	C	5	DA
33.11.03	Usluge popravka i održavanja parnih kotlova, osim kotlova za centralno grijanje toplom vodom	C	5	DA
33.11.04	Usluge popravka i održavanja oružja i streljiva	C	5	DA
33.11.05	Usluge popravka i održavanja ostalih metalnih proizvoda	C	5	DA
33.12.11	Usluge popravka i održavanja motora i turbina, osim motora za zrakoplove i motorna vozila	C	5	DA
33.12.12	Usluge popravka i održavanja hidrauličnih pogonskih uređaja, ostalih crpki, kompresora, slavina i ventila	C	5	DA
33.12.13	Usluge popravka i održavanja ležajeva, prijenosnika, prijenosnih i pogonskih elemenata	C	5	DA
33.12.14	Usluge popravka i održavanja peći i plamenika	C	5	DA
33.12.15	Usluge popravka i održavanja strojeva za dizanje i prenošenje	C	5	DA
33.12.16	Usluge popravka i održavanja uredskih strojeva i opreme, osim računala i periferne opreme	C	5	DA
33.12.17	Usluge popravka i održavanja mehaniziranog ručnog alata	C	5	DA
33.12.18	Usluge popravka i održavanja rashladne i ventilacijske opreme, osim za kućanstvo	C	5	DA
33.12.19	Usluge popravka i održavanja ostalih strojeva za opće namjene, d. n.	C	5	DA
33.12.21	Usluge popravka i održavanja strojeva za poljoprivredu i šumarstvo	C	5	DA
33.12.22	Usluge popravka i održavanja strojeva za obradu metala i alatnih strojeva	C	5	DA
33.12.23	Usluge popravka i održavanja strojeva za metalurgiju	C	5	DA
33.12.24	Usluge popravka i održavanja strojeva za rudnike, kamenolome i građevinarstvo	C	5	DA
33.12.25	Usluge popravka i održavanja strojeva za industriju hrane, pića i duhana	C	5	DA
33.12.26	Usluge popravka i održavanja strojeva za industriju tekstila, odjeće i kože	C	5	DA
33.12.27	Usluge popravka i održavanja strojeva za industriju papira i kartona	C	5	DA
33.12.28	Usluge popravka i održavanja strojeva za industriju plastike i gume	C	5	DA
33.12.29	Usluge popravka i održavanja ostalih strojeva za posebne namjene	C	5	DA
33.13.01	Usluge popravka i održavanja instrumenata i aparata za mjerenje, ispitivanje i navigaciju	C	5	DA
33.13.02	Usluge popravka i održavanja opreme za zračenje, elektromedicinske i elektroterapeutske opreme	C	5	DA
33.13.03	Usluge popravka i održavanja profesionalnih optičkih instrumenata i fotografske opreme	C	5	DA
33.13.04	Usluge popravka i održavanja ostale profesionalne elektroničke opreme	C	5	DA
33.14.01	Usluge popravka i održavanja elektromotora, generatora, transformatora i opreme za distribuciju i kontrolu električne energije	C	5	DA
33.14.02	Usluge popravka i održavanja ostale profesionalne električne opreme	C	5	DA
33.15.00	Usluge popravka i održavanja civilnih brodova i čamaca	C	5	DA
33.16.01	Usluge popravka i održavanja civilnih zrakoplova	C	5	DA
33.16.02	Usluge popravka i održavanja civilnih svemirskih letjelica	C	5	DA
33.17.01	Usluge popravka i održavanja željezničkih lokomotiva i tračničkih vozila	C	5	DA
33.17.09	Usluge popravka i održavanja ostalih civilnih prijevoznih sredstava, d. n.	C	5	DA
33.18.01	Usluge popravka i održavanja vojnih zrakoplova	C	5	DA
33.18.02	Usluge popravka i održavanja vojnih svemirskih letjelica	C	5	DA
33.18.03	Usluge popravka i održavanja vojnih borbenih vozila	C	5	DA
33.18.04	Usluge popravka i održavanja vojnih brodova i plovila	C	5	DA
33.19.00	Usluge popravka i održavanja ostale opreme	C	5	DA
33.20.11	Usluge instaliranja parnih kotlova, osim kotlova za centralno grijanje toplom vodom, uključujući usluge instaliranja cijevnih sustava u industrijskim pogonima	C	5	DA
33.20.12	Usluge instaliranja ostalih proizvoda od metala, osim strojeva i opreme	C	5	DA
33.20.21	Usluge instaliranja uredskih i računovodstvenih strojeva	C	5	DA
33.20.29	Usluge instaliranja ostalih strojeva za opće namjene, d. n.	C	5	DA
33.20.31	Usluge instaliranja industrijskih strojeva i opreme za poljoprivredu	C	5	DA
33.20.32	Usluge instaliranja strojeva za obradu metala	C	5	DA
33.20.33	Usluge instaliranja industrijskih strojeva i opreme za metalurgiju	C	5	DA
33.20.34	Usluge instaliranja industrijskih strojeva i opreme za rudnike	C	5	DA
33.20.35	Usluge instaliranja industrijskih strojeva i opreme za industriju hrane, pića i duhana	C	5	DA
33.20.36	Usluge instaliranja industrijskih strojeva i opreme za industriju tekstila, odjeće i kože	C	5	DA
33.20.37	Usluge instaliranja industrijskih strojeva i opreme za industriju papira i kartona	C	5	DA
33.20.38	Usluge instaliranja industrijskih strojeva i opreme za industriju plastike i gume	C	5	DA
33.20.39	Usluge instaliranja ostalih strojeva za posebne namjene	C	5	DA
33.20.41	Usluge instaliranja profesionalnih medicinskih strojeva i preciznih optičkih instrumenata	C	5	DA
33.20.42	Usluge instaliranja profesionalne elektroničke opreme	C	5	DA
33.20.50	Usluge instaliranja električne opreme	C	5	DA
33.20.60	Usluge instaliranja automatskih sustava za kontrolu industrijskih procesa	C	5	DA
33.20.70	Usluge instaliranja plastičnih cijevnih sustava u industrijskim pogonima	C	5	DA
33.20.90	Usluge instaliranja ostalih proizvoda, d. n.	C	5	DA
35.11.00	Električna energija iz neobnovljivih izvora	D	5	DA
35.12.00	Električna energija iz obnovljivih izvora	D	5	DA
35.13.00	Usluge prijenosa električne energije	D	5	DA
35.14.00	Usluge distribucije električne energije	D	5	DA
35.15.01	Usluge trgovine električnom energijom za električnu mobilnost	D	5	DA
35.15.02	Usluge trgovine električnom energijom, osim za električnu mobilnost	D	5	DA
35.16.00	Usluge skladištenja električne energije	D	5	DA
35.21.01	Plin dobiven iz konvencionalnih izvora, za opskrbu energijom	D	5	DA
35.21.02	Plin dobiven iz obnovljivih izvora, za opskrbu energijom	D	5	DA
35.21.03	Oporabljeni plin, za opskrbu energijom	D	5	DA
35.22.00	Usluge distribucije plinovitih goriva distribucijskom mrežom	D	5	DA
35.23.00	Usluge trgovine plinom distribucijskom mrežom	D	5	DA
35.24.00	Usluge skladištenja plina kao dio usluge opskrbe putem mreže	D	5	DA
35.30.11	Para i topla voda	D	5	DA
35.30.12	Usluge opskrbe parom i toplom vodom distribucijskom mrežom	D	5	DA
35.30.20	Usluge klimatizacije	D	5	DA
35.30.31	Led, uključujući led za hlađenje (tj. ne za prehranu)	D	5	DA
35.30.32	Usluge opskrbe hladnim zrakom i hladnom vodom	D	5	DA
35.40.00	Usluge brokera i agenata za električnu energiju i plin	D	5	DA
36.00.11	Pitka voda	E	5	DA
36.00.12	Voda za druge svrhe	E	5	DA
36.00.21	Usluge pročišćavanja i distribucije vode distribucijskom mrežom	E	5	DA
36.00.22	Usluge pročišćavanja i distribucije vode za navodnavanje	E	5	DA
36.00.23	Usluge pročišćavanja i distribucije vode za druge svrhe	E	5	DA
36.00.30	Usluge trgovine vodom distribucijskom mrežom	E	5	DA
37.00.11	Usluge uklanjanja i pročišćavanja otpadnih voda	E	5	DA
37.00.12	Usluge pražnjenja i čišćenja septičkih i sabirnih jama	E	5	DA
37.00.20	Kanalizacijski mulj	E	5	DA
38.11.11	Usluge skupljanja neopasnog oporabljivog komunalnog otpada	E	5	DA
38.11.19	Usluge skupljanja neopasnog oporabljivog otpada, d. n.	E	5	DA
38.11.21	Usluge skupljanja neopasnog neoporabljivog komunalnog otpada	E	5	DA
38.11.29	Usluge skupljanja neopasnog neoporabljivog otpada, d. n.	E	5	DA
38.11.31	Neoporabljivi neopasni komunalni otpad	E	5	DA
38.11.39	Prikupljeni neoporabljivi neopasni otpad, d. n.	E	5	DA
38.11.41	Brodovi i ostali ploveći objekti, za rezanje	E	5	DA
38.11.42	Rabljeni automobili, računala, televizori i druga oprema za demontiranje	E	5	DA
38.11.51	Stakleni otpad	E	5	DA
38.11.52	Papirni i kartonski otpad	E	5	DA
38.11.53	Rabljene pneumatske gume	E	5	DA
38.11.54	Ostali gumeni otpad	E	5	DA
38.11.55	Plastični otpad	E	5	DA
38.11.56	Tekstilni otpad	E	5	DA
38.11.57	Kožni otpad	E	5	DA
38.11.58	Neopasni metalni otpad	E	5	DA
38.11.59	Ostali prikupljeni oporabljivi neopasni otpad, d. n.	E	5	DA
38.11.60	Rabljena odjeća i ostali rabljeni tekstilni proizvodi	E	5	DA
38.11.71	Usluge upravljanja objektima za odvoz neopasnog oporabljivog otpada	E	5	DA
38.11.79	Usluge upravljanja objektima za odvoz neopasnog otpada, d. n.	E	5	DA
38.12.11	Usluge skupljanja opasnog medicinskog i ostalog biološki opasnog otpada	E	5	DA
38.12.12	Usluge skupljanja visoko radioaktivnog otpada	E	5	DA
38.12.13	Usluge skupljanja ostalog opasnog industrijskog otpada	E	5	DA
38.12.14	Usluge skupljanja opasnog komunalnog otpada	E	5	DA
38.12.21	Iskorišteni (ozračeni) gorivni elementi nuklearnih reaktora	E	5	DA
38.12.22	Farmaceutski otpad	E	5	DA
38.12.23	Ostali opasni medicinski otpad	E	5	DA
38.12.24	Opasni kemijski otpad	E	5	DA
38.12.25	Otpadna ulja	E	5	DA
38.12.26	Opasni metalni otpad	E	5	DA
38.12.27	Otpaci i ostaci od primarnih stanica, primarnih baterija i električnih akumulatora	E	5	DA
38.12.28	Ostali opasni otpad	E	5	DA
38.12.30	Usluge upravljanja objektima za odvoz opasnog otpada	E	5	DA
38.21.11	Usluge oporabe metalnih materijala	E	5	DA
38.21.12	Usluge oporabe ostalih materijala	E	5	DA
38.21.13	Briketi proizvedeni od nekoliko različitih vrsta industrijskih otpada itd.	E	5	DA
38.21.21	Sekundarne sirovine od plemenitih metala	E	5	DA
38.21.22	Sekundarne sirovine od željeza i čelika	E	5	DA
38.21.23	Sekundarne sirovine od bakra	E	5	DA
38.21.24	Sekundarne sirovine od nikla	E	5	DA
38.21.25	Sekundarne sirovine od aluminija	E	5	DA
38.21.26	Sekundarne sirovine od ostalih metala	E	5	DA
38.21.31	Sekundarne sirovine od stakla	E	5	DA
38.21.32	Sekundarne sirovine od papira i kartona	E	5	DA
38.21.33	Sekundarne sirovine od plastike	E	5	DA
38.21.34	Sekundarne sirovine od gume	E	5	DA
38.21.35	Sekundarne sirovine od tekstila	E	5	DA
38.21.36	Sekundarne sirovine od minerala dobivenih rušenjem	E	5	DA
38.21.37	Sekundarne sirovine od ostalih nemetalnih materijala	E	5	DA
38.21.41	Usluge demontiranja olupina	E	5	DA
38.21.42	Usluge rezanja brodova	E	5	DA
38.21.43	Usluge demontiranja rabljenih automobila, računala, televizora i druge opreme	E	5	DA
38.21.50	Usluge obrade otpada prije oporabe	E	5	DA
38.22.10	Usluge oporabe energije	E	5	DA
38.22.20	Pelete od komunalnog otpada za spaljivanje s dobivanjem energije	E	5	DA
38.23.00	Usluge oporabe ostalog otpada	E	5	DA
38.31.10	Usluge spaljivanja opasnog otpada bez dobivanja energije	E	5	DA
38.31.20	Usluge spaljivanja neopasnog otpada bez dobivanja energije	E	5	DA
38.31.30	Otpadna organska otapala	E	5	DA
38.31.40	Pepeo i drugi ostaci spaljenog otpada	E	5	DA
38.31.50	Pelete od komunalnog otpada za spaljivanje bez dobivanja energije	E	5	DA
38.31.60	Usluge obrade otpada prije spaljivanja bez dobivanja energije	E	5	DA
38.32.11	Usluge sanitarnog odlaganja neopasnog otpada	E	5	DA
38.32.12	Ostale usluge odlaganja ili trajnog skladištenja neopasnog otpada	E	5	DA
38.32.21	Usluge obrade visoko radioaktivnog otpada prije odlaganja ili trajnog skladištenja	E	5	DA
38.32.22	Ostale usluge obrade radioaktivnog otpada prije odlaganja ili trajnog skladištenja	E	5	DA
38.32.23	Ostale usluge obrade opasnog otpada prije odlaganja ili trajnog skladištenja	E	5	DA
38.32.24	Usluge odlaganja ili trajnog skladištenja visoko radioaktivnog otpada	E	5	DA
38.32.25	Ostale usluge odlaganja ili trajnog skladištenja visoko radioaktivnog otpada	E	5	DA
38.32.26	Ostale usluge odlaganja ili trajnog skladištenja opasnog otpada	E	5	DA
38.33.00	Ostale usluge zbrinjavanja otpada	E	5	DA
39.00.11	Usluge sanacije i čišćenja zemljišta i podzemnih voda	E	5	DA
39.00.12	Usluge sanacije i čišćenja površinskih voda	E	5	DA
39.00.13	Usluge sanacije i čišćenja zraka	E	5	DA
39.00.14	Usluge sanacije zgrada	E	5	DA
39.00.21	Usluge ograničavanja zagađenja, kontrole i nadzora sanacije zagađenih lokacija i ostale usluge sanacije zagađenih lokacija	E	5	DA
39.00.22	Ostale usluge sanacije okoliša	E	5	DA
39.00.23	Ostale posebne usluge kontrole onečišćenja	E	5	DA
41.00.11	Stambene zgrade s jednim stanom	F	5	DA
41.00.12	Stambene zgrade s dva stana	F	5	DA
41.00.13	Stambene zgrade s tri i više stanova	F	5	DA
41.00.14	Stambene zgrade za stanovanje zajednica	F	5	DA
41.00.21	Industrijske zgrade	F	5	DA
41.00.22	Nestambene poljoprivredne zgrade	F	5	DA
41.00.23	Uredske zgrade	F	5	DA
41.00.24	Zgrade za trgovinu na veliko i malo	F	5	DA
41.00.25	Zgrade za promet i komunikacije	F	5	DA
41.00.26	Rezervoari, silosi i skladišta	F	5	DA
41.00.27	Hoteli i slične zgrade	F	5	DA
41.00.28	Zgrade za kulturno-umjetničku djelatnost i zabavu, obrazovne ustanove, bolnice, zgrade za institucionalnu skrb i zgrade za vjerske obrede	F	5	DA
41.00.29	Nestambene zgrade, d. n.	F	5	DA
41.00.31	Građevinski radovi na izgradnji stambenih zgrada s jednim stanom	F	5	DA
41.00.32	Građevinski radovi na izgradnji stambenih zgrada s dva stana	F	5	DA
41.00.33	Građevinski radovi na izgradnji stambenih zgrada s tri i više stanova	F	5	DA
41.00.34	Građevinski radovi na izgradnji stambenih zgrada za stanovanje zajednica	F	5	DA
41.00.41	Građevinski radovi na izgradnji industrijskih zgrada	F	5	DA
41.00.42	Građevinski radovi na izgradnji nestambenih poljoprivrednih zgrada	F	5	DA
41.00.43	Građevinski radovi na izgradnji uredskih zgrada	F	5	DA
41.00.44	Građevinski radovi na izgradnji zgrada za trgovinu na veliko i malo	F	5	DA
41.00.45	Građevinski radovi na izgradnji zgrada za promet i komunikacije	F	5	DA
41.00.46	Građevinski radovi na izgradnji rezervoara, silosa i skladišta	F	5	DA
41.00.47	Građevinski radovi na izgradnji hotela i sličnih zgrada	F	5	DA
41.00.48	Građevinski radovi na izgradnji građevina za kulturno-umjetničku djelatnost i zabavu, obrazovnih ustanova, bolnica, zgrada za institucionalnu skrb i zgrada za vjerske obrede	F	5	DA
41.00.49	Građevinski radovi na izgradnji nestambenih zgrada, d. n.	F	5	DA
42.11.10	Autoceste, ceste, ulice i ostale prometnice ili pješački putovi i uzletišta u zračnim lukama	F	5	DA
42.11.20	Građevinski radovi na izgradnji autocesta, cesta, ulica i ostalih prometnica ili pješačkih putova te uzletišta u zračnim lukama	F	5	DA
42.12.10	Željezničke pruge i podzemne željeznice	F	5	DA
42.12.20	Građevinski radovi na izgradnji željezničkih pruga i podzemnih željeznica	F	5	DA
42.13.10	Mostovi i tuneli	F	5	DA
42.13.20	Građevinski radovi na izgradnji mostova i tunela	F	5	DA
42.21.11	Magistralni cjevovodi za tekućine i plinove	F	5	DA
42.21.12	Lokalni cjevovodi za tekućine i plinove	F	5	DA
42.21.13	Sustavi za navodnjavanje (kanali); vodovodne mreže i cjevovodi; postrojenja za pročišćavanje vode, postrojenja za zbrinjavanje otpadnih voda i crpne stanice	F	5	DA
42.21.21	Građevinski radovi na izgradnji magistralnih cjevovoda	F	5	DA
42.21.22	Građevinski radovi na izgradnji lokalnih cjevovoda, uključujući pomoćne radove	F	5	DA
42.21.23	Građevinski radovi na izgradnji sustava za navodnjavanje (kanala), vodovodnih mreža i cjevovoda, postrojenja za pročišćavanje vode, postrojenja za zbrinjavanje otpadnih voda i crpnih stanica	F	5	DA
42.21.24	Radovi na bušenju vodocrpilišta i iskopavanju septičkih jama	F	5	DA
42.22.11	Magistralni elektroenergetski i telekomunikacijski vodovi	F	5	DA
42.22.12	Lokalni elektroenergetski i telekomunikacijski vodovi	F	5	DA
42.22.13	Elektrane	F	5	DA
42.22.21	Građevinski radovi na izgradnji magistralnih elektroenergetskih i telekomunikacijskih vodova	F	5	DA
42.22.22	Građevinski radovi na izgradnji lokalnih elektroenergetskih i telekomunikacijskih vodova	F	5	DA
42.22.23	Građevinski radovi na izgradnji elektrana	F	5	DA
42.91.10	Luke, pristaništa, brane, ustavi i srodne hidromehaničke građevine	F	5	DA
42.91.20	Građevinski radovi na izgradnji luka, pristaništa, brana, ustava i srodnih hidromehaničkih građevina	F	5	DA
42.99.11	Građevine za rudarstvo i industriju	F	5	DA
42.99.12	Građevine za sport i rekreaciju	F	5	DA
42.99.19	Ostale građevine niskogradnje, d. n.	F	5	DA
42.99.21	Građevinski radovi na izgradnji građevina za rudarstvo i industriju	F	5	DA
42.99.22	Građevinski radovi na izgradnji sportske infrastrukture na otvorenom	F	5	DA
42.99.23	Građevinski radovi na izgradnji unutarnje sportske infrastrukture	F	5	DA
42.99.29	Građevinski radovi na izgradnji ostalih građevina niskogradnje, d. n.	F	5	DA
43.11.00	Radovi na uklanjanju građevina	F	5	DA
43.12.01	Radovi na pripremi zemljišta; raščišćavanje terena	F	5	DA
43.12.02	Radovi na iskopavanju i uklanjanju zemlje	F	5	DA
43.13.00	Radovi na pokusnom bušenju i sondiranju terena za gradnju	F	5	DA
43.21.00	Elektroinstalacijski radovi	F	5	DA
43.22.11	Radovi na uvođenju instalacija za vodovod i kanalizaciju (odvod)	F	5	DA
43.22.12	Radovi na uvođenju instalacija za grijanje, ventilaciju i klimatizaciju	F	5	DA
43.22.20	Radovi na uvođenju instalacija za plin	F	5	DA
43.23.10	Radovi na postavljanju izolacije	F	5	DA
43.23.20	Radovi na hidroizolaciji	F	5	DA
43.24.00	Ostali građevinski instalacijski radovi	F	5	DA
43.31.00	Fasadni i štukaturni radovi	F	5	DA
43.32.01	Radovi na ugradnji drvne stolarije	F	5	DA
43.32.02	Radovi na ugradnji metalne stolarije	F	5	DA
43.32.09	Radovi na ugradnji stolarije, d. n.	F	5	DA
43.33.10	Radovi na postavljanju podnih i zidnih obloga od kamena, betonskih blokova, keramičkih pločica i ploča	F	5	DA
43.33.20	Radovi na postavljanju parketa i ostalih drvenih podnih i zidnih obloga	F	5	DA
43.33.90	Radovi na postavljanju podnih i zidnih obloga, d. n.	F	5	DA
43.34.10	Soboslikarski radovi	F	5	DA
43.34.20	Staklarski radovi	F	5	DA
43.35.01	Radovi na postavljanju ukrasnih elemenata	F	5	DA
43.35.09	Ostali završni građevinski radovi, d. n.	F	5	DA
43.41.01	Radovi na podizanju krovnih konstrukcija	F	5	DA
43.41.09	Radovi na krovištu, d. n.	F	5	DA
43.42.11	Radovi na montaži čeličnih elemenata u gradnji zgrada	F	5	DA
43.42.12	Radovi na zabijanju stupova (pilona) u gradnji zgrada	F	5	DA
43.42.90	Ostali specijalizirani građevinski radovi u gradnji zgrada, d. n.	F	5	DA
43.50.01	Radovi na zabijanju stupova (pilona) i radovi na fundiranju u niskogradnji	F	5	DA
43.50.02	Gradnja montažnih bazena	F	5	DA
43.50.03	Ostali specijalizirani građevinski radovi u niskogradnji	F	5	DA
43.60.00	Usluge posredovanja u pružanju specijaliziranih građevinskih usluga	F	5	DA
43.91.00	Zidarski radovi	F	5	DA
43.99.10	Radovi na postavljanju skela	F	5	DA
43.99.20	Radovi na betoniranju	F	5	DA
43.99.30	Radovi na sastavljanju i podizanju montažnih građevina	F	5	DA
43.99.40	Usluge iznajmljivanja dizalica (kranova) i građevinskih strojeva s rukovateljem, d. n.	F	5	DA
43.99.90	Specijalizirani građevinski radovi, d. n.	F	5	DA
46.11.01	Usluge trgovine na veliko, uz naplatu ili na osnovi ugovora, živim životinjama	G	5	DA
46.11.02	Usluge trgovine na veliko, uz naplatu ili na osnovi ugovora, cvijećem i sadnicama	G	5	DA
46.11.09	Usluge trgovine na veliko, uz naplatu ili na osnovi ugovora, poljoprivrednim sirovinama, živim životinjama, tekstilnim sirovinama i poluproizvodima, d. n.	G	5	DA
46.12.01	Usluge trgovine na veliko, uz naplatu ili na osnovi ugovora, krutim, tekućim i plinovitim gorivima i sličnim proizvodima	G	5	DA
46.12.02	Usluge trgovine na veliko, uz naplatu ili na osnovi ugovora, metalnim rudama i metalima u izvornom obliku	G	5	DA
46.12.03	Usluge trgovine na veliko, uz naplatu ili na osnovi ugovora, industrijskim kemikalijama, gnojivima i agrokemijskim proizvodima	G	5	DA
46.13.01	Usluge trgovine na veliko, uz naplatu ili na osnovi ugovora, drvenom građom i proizvodima od drva	G	5	DA
46.13.02	Usluge trgovine na veliko, uz naplatu ili na osnovi ugovora, građevinskim materijalima	G	5	DA
46.14.01	Usluge trgovine na veliko, uz naplatu ili na osnovi ugovora, računalima, softverom, elektroničkom i telekomunikacijskom opremom te ostalom uredskom opremom	G	5	DA
46.14.02	Usluge trgovine na veliko, uz naplatu ili na osnovi ugovora, brodovima, zrakoplovima i ostalom transportnom opremom	G	5	DA
46.14.03	Usluge trgovine na veliko, uz naplatu ili na osnovi ugovora, strojevima i industrijskom opremom	G	5	DA
46.15.01	Usluge trgovine na veliko, uz naplatu ili na osnovi ugovora, namještajem	G	5	DA
46.15.02	Usluge trgovine na veliko, uz naplatu ili na osnovi ugovora, radiouređajima, televizorima i videoopremom	G	5	DA
46.15.03	Usluge trgovine na veliko, uz naplatu ili na osnovi ugovora, željeznom robom i ručnim alatom	G	5	DA
46.15.04	Usluge trgovine na veliko, uz naplatu ili na osnovi ugovora, ostalim proizvodima za kućanstvo	G	5	DA
46.16.01	Usluge trgovine na veliko, uz naplatu ili na osnovi ugovora, tekstilom	G	5	DA
46.16.02	Usluge trgovine na veliko, uz naplatu ili na osnovi ugovora, odjećom i krznom	G	5	DA
46.16.03	Usluge trgovine na veliko, uz naplatu ili na osnovi ugovora, obućom, proizvodima od kože i putnom opremom	G	5	DA
46.17.01	Usluge trgovine na veliko, uz naplatu ili na osnovi ugovora, hranom	G	5	DA
46.17.02	Usluge trgovine na veliko, uz naplatu ili na osnovi ugovora, pićima	G	5	DA
46.17.03	Usluge trgovine na veliko, uz naplatu ili na osnovi ugovora, duhanom	G	5	DA
46.18.11	Usluge trgovine na veliko, uz naplatu ili na osnovi ugovora, automobilima i motornim vozilima lake kategorije	G	5	DA
